{"schema_version":1,"role":"baseline_verify","work_id":"baseline-revision-2","outcome":"definition_rejected","summary":"benchmark输出不完整","files":{},"details":{"baseline_revision":2,"definition_sha256":"cccccccccccccccccccccccccccccccccccccccccccccccccccccccccccccccc","development_sha":"dddddddddddddddddddddddddddddddddddddddd","failure_kind":"benchmark","reason":"缺少metric记录","requested_changes":["补齐每个case的全部metrics"]}}
