{"schema_version":1,"role":"baseline_verify","work_id":"baseline-revision-1","outcome":"definition_rejected","summary":"verify script遗漏case","files":{},"details":{"baseline_revision":1,"definition_sha256":"aaaaaaaaaaaaaaaaaaaaaaaaaaaaaaaaaaaaaaaaaaaaaaaaaaaaaaaaaaaaaaaa","development_sha":"bbbbbbbbbbbbbbbbbbbbbbbbbbbbbbbbbbbbbbbb","failure_kind":"definition","reason":"case 7未被脚本列出","requested_changes":["修复--list-cases覆盖"]}}
